{
  "$schema": "http://json-schema.org/draft-07/schema#",
  "$id": "https://github.com/MacCracken/secureyeoman-community-repo/schema/skill.schema.json",
  "title": "SecureYeoman Community Skill",
  "description": "Schema for a community-contributed SecureYeoman skill",
  "type": "object",
  "required": ["name", "instructions"],
  "additionalProperties": false,
  "properties": {
    "$schema": {
      "type": "string"
    },
    "name": {
      "type": "string",
      "minLength": 1,
      "maxLength": 200,
      "description": "Unique, human-readable skill name (max 200 chars)"
    },
    "description": {
      "type": "string",
      "maxLength": 2000,
      "default": "",
      "description": "Short description shown in the marketplace (max 2000 chars)"
    },
    "version": {
      "type": "string",
      "maxLength": 50,
      "pattern": "^\\d{4}\\.\\d{1,2}\\.\\d{1,2}(-\\d+)?$",
      "default": "2026.2.28",
      "description": "Release date version (YYYY.M.D). Same-day patches use a -N suffix, e.g. 2026.2.28-1."
    },
    "author": {
      "description": "Skill author. May be a plain string (legacy) or a structured object with attribution links.",
      "oneOf": [
        {
          "type": "string",
          "maxLength": 200,
          "description": "Legacy string form — your GitHub username or real name."
        },
        {
          "type": "object",
          "description": "Structured author object with optional attribution links.",
          "required": ["name"],
          "additionalProperties": false,
          "properties": {
            "name": {
              "type": "string",
              "maxLength": 200,
              "description": "Author display name."
            },
            "github": {
              "type": "string",
              "maxLength": 200,
              "description": "GitHub username (without the @ prefix)."
            },
            "website": {
              "type": "string",
              "format": "uri",
              "maxLength": 500,
              "description": "Author or project website URL."
            },
            "license": {
              "type": "string",
              "maxLength": 100,
              "description": "SPDX license identifier (e.g. 'MIT', 'Apache-2.0'). Defaults to project license if omitted."
            }
          }
        }
      ]
    },
    "category": {
      "type": "string",
      "maxLength": 100,
      "enum": [
        "development",
        "productivity",
        "security",
        "utilities",
        "design",
        "finance",
        "science",
        "general"
      ],
      "default": "general",
      "description": "Skill category — must match the directory name"
    },
    "tags": {
      "type": "array",
      "items": {
        "type": "string",
        "maxLength": 50
      },
      "maxItems": 20,
      "default": [],
      "description": "Searchable tags (lowercase kebab-case, e.g. 'code-review')"
    },
    "instructions": {
      "type": "string",
      "minLength": 1,
      "maxLength": 8000,
      "description": "Full agent instructions. Minimum 100 words recommended for quality bar."
    },
    "tools": {
      "type": "array",
      "items": {
        "type": "object"
      },
      "default": [],
      "description": "Optional MCP tool definitions (advanced)"
    },
    "triggerPatterns": {
      "type": "array",
      "items": {
        "type": "string",
        "maxLength": 500
      },
      "maxItems": 20,
      "description": "Regex patterns (case-insensitive) that gate injection of this skill's instructions into the system prompt. When the user message matches any pattern, the full instructions block is injected. Falls back to skill-name keyword matching when empty. Use specific phrases: e.g. 'review.*code|code.*review', '\\bpr\\b|pull.?request'.",
      "default": []
    },
    "useWhen": {
      "type": "string",
      "maxLength": 500,
      "default": "",
      "description": "Conditions under which this skill should activate. Injected into the skill catalog in the system prompt so the model understands activation intent. Plain language — e.g. 'user asks to review a PR or diff'."
    },
    "doNotUseWhen": {
      "type": "string",
      "maxLength": 500,
      "default": "",
      "description": "Conditions under which this skill should NOT activate. Prevents false positives. Plain language — e.g. 'writing new code from scratch or debugging a runtime error'."
    },
    "successCriteria": {
      "type": "string",
      "maxLength": 300,
      "default": "",
      "description": "How the model knows the skill is complete. Appended after skill instructions. State concrete output requirements — e.g. 'Review complete with: summary, critical issues, suggestions, and at least one positive'."
    },
    "mcpToolsAllowed": {
      "type": "array",
      "items": { "type": "string" },
      "default": [],
      "description": "When non-empty, only these MCP tool names are available while this skill is active. Empty (default) means all enabled tools are available. Use to scope security-sensitive skills."
    },
    "routing": {
      "type": "string",
      "enum": ["fuzzy", "explicit"],
      "default": "fuzzy",
      "description": "Routing mode. 'fuzzy' (default) — model uses judgment. 'explicit' — appends deterministic routing text: 'To perform [Skill Name] tasks, use the [Skill Name] skill.' Use explicit for SOPs and compliance workflows."
    },
    "autonomyLevel": {
      "type": "string",
      "enum": ["L1", "L2", "L3", "L4", "L5"],
      "default": "L1",
      "description": "AI autonomy classification level. L1=fully supervised (AI assists on request), L2=collaborative (AI proposes, human decides), L3=supervised (AI acts, human reviews), L4=delegated (AI acts, human audits), L5=fully autonomous. Community skills should default to L1."
    }
  }
}
